{
  "schemaVersion": 2,
  "version": "0.6.98",
  "baseTag": "v0.6.97",
  "items": [
    {
      "section": "Changed",
      "text": "**Managed-storage projection recovery is prepared for cheaper durable publication.** Every projection-only producer now records one durable, description-only turn before graph mutation, while foreground saves replay through the same turn-level executor. Existing projection receipts remain as redundant recovery evidence, startup drains semantic edits before projection turns, and a disposable per-page SQLite digest avoids rendering an unchanged page merely to prove it needs no terminal repair. Durability-barrier budgets remain 25 for a save and 74 for a cross-page move.",
      "userVisible": true,
      "regressions": [],
      "guide": {
        "status": "not-applicable",
        "reason": "performance-only; the user workflow and controls are unchanged",
        "refs": []
      },
      "docs": {
        "status": "current",
        "reason": "The managed-storage contract documents the affected durability, recovery and performance boundary.",
        "refs": [
          "docs/storage-sync-contract.md"
        ]
      },
      "website": {
        "status": "not-applicable",
        "reason": "This patch item does not require a separate public marketing-site change.",
        "refs": []
      },
      "blog": {
        "status": "not-applicable",
        "reason": "Patch release; the changelog carries the relevant release detail.",
        "refs": []
      }
    },
    {
      "section": "Changed",
      "text": "**The shared parser is updated to lsdoc v0.5.6.** Raw HTML recognition now indexes every supported tag in one source pass, static HTML export renders safe Hiccup vectors as markup, and deeply nested projections serialize iteratively instead of consuming the native stack. Native and browser-WASM consumers use the same released parser and serialization contract.",
      "userVisible": true,
      "regressions": [],
      "guide": {
        "status": "update",
        "reason": "The Feature showcase now documents and exercises safe Hiccup rendering.",
        "refs": [
          "crates/tine-core/src/templates/showcase.md"
        ]
      },
      "docs": {
        "status": "current",
        "reason": "The released lsdoc receipt and Tine's pinned native/WASM boundary document the parser update.",
        "refs": [
          "crates/lsdoc-wasm/src/lib.rs",
          "src/devtools/lsdoc-diff/vendor/oracle.source.json"
        ]
      },
      "website": {
        "status": "not-applicable",
        "reason": "This patch item does not require a separate public marketing-site change.",
        "refs": []
      },
      "blog": {
        "status": "not-applicable",
        "reason": "Patch release; the changelog carries the relevant release detail.",
        "refs": []
      }
    },
    {
      "section": "Changed",
      "text": "**Startup no longer loads the complete Settings implementation before the first page appears.** Settings and its plugin, theme, backup, and diagnostics controls now load only when opened; the small journal-conflict row shared with Concord remains available independently. Native startup is back within the immutable v0.4.7 performance budget.",
      "userVisible": true,
      "regressions": [
        "UI-DESKTOP-STABLE-STARTUP-001"
      ],
      "guide": {
        "status": "not-applicable",
        "reason": "performance-only; the Settings workflow and controls are unchanged",
        "refs": []
      },
      "docs": {
        "status": "current",
        "reason": "The release startup contract and immutable baseline already document this performance boundary.",
        "refs": [
          "docs/RELEASE-CHECKLIST.md",
          "docs/UI-REGRESSION-TESTING.md"
        ]
      },
      "website": {
        "status": "not-applicable",
        "reason": "This startup optimization does not change the public website.",
        "refs": []
      },
      "blog": {
        "status": "not-applicable",
        "reason": "Patch release; the changelog carries the relevant release detail.",
        "refs": []
      }
    },
    {
      "section": "Changed",
      "text": "**Managed storage's private receipt-store format has been bumped** (development only). Projection records now carry an explicit target-kind discriminant, so a private store created by an earlier build is refused with a named notice telling you to re-activate managed storage for that graph. Your Markdown files are untouched by the refusal — the check runs before anything can modify the graph. Managed storage has not shipped, so no released build can have created such a store; this affects development machines only.",
      "userVisible": false,
      "regressions": [],
      "guide": {
        "status": "not-applicable",
        "reason": "internal-only; no user workflow or control changed",
        "refs": []
      },
      "docs": {
        "status": "current",
        "reason": "The managed-storage contract documents the affected durability, recovery and performance boundary.",
        "refs": [
          "docs/storage-sync-contract.md"
        ]
      },
      "website": {
        "status": "not-applicable",
        "reason": "This patch item does not require a separate public marketing-site change.",
        "refs": []
      },
      "blog": {
        "status": "not-applicable",
        "reason": "Patch release; the changelog carries the relevant release detail.",
        "refs": []
      }
    },
    {
      "section": "Changed",
      "text": "**Saving a page performs fewer disk-durability round trips** (28 → 25 core-initiated barriers per accepted single-block save; 77 → 74 for a cross-page move). Three barriers defended no failure Tine's threat model covers: a re-flush of a file that was already flushed before publication, a durable queue-state write on an empty cleanup queue, and a flush of a file about to be moved aside whose exact bytes are already recorded. Edits feel the difference most on slow, networked, or synced filesystems.",
      "userVisible": true,
      "regressions": [
        "REG-CORE-MANAGED-SAVE-DURABILITY-BARRIER-CONFETTI"
      ],
      "guide": {
        "status": "not-applicable",
        "reason": "performance-only; the user workflow and controls are unchanged",
        "refs": []
      },
      "docs": {
        "status": "current",
        "reason": "The managed-storage contract documents the affected durability, recovery and performance boundary.",
        "refs": [
          "docs/storage-sync-contract.md"
        ]
      },
      "website": {
        "status": "not-applicable",
        "reason": "This patch item does not require a separate public marketing-site change.",
        "refs": []
      },
      "blog": {
        "status": "not-applicable",
        "reason": "Patch release; the changelog carries the relevant release detail.",
        "refs": []
      }
    },
    {
      "section": "Added",
      "text": "**Keyboard Shortcuts can now be searched in place** (GH #380). The existing Settings search field filters command names, IDs, and bindings while that section is open, including built-in shortcuts and a clear no-results state.",
      "userVisible": true,
      "regressions": [
        "UI-SHORTCUT-SEARCH-380"
      ],
      "guide": {
        "status": "update",
        "reason": "The shortcut Guide now explains how to search the remappable command list.",
        "refs": [
          "crates/tine-core/src/templates/tips.md"
        ]
      },
      "docs": {
        "status": "not-applicable",
        "reason": "The changelog and regression evidence fully describe this patch behavior; no separate contract update is needed.",
        "refs": []
      },
      "website": {
        "status": "not-applicable",
        "reason": "This patch item does not require a separate public marketing-site change.",
        "refs": []
      },
      "blog": {
        "status": "not-applicable",
        "reason": "Patch release; the changelog carries the relevant release detail.",
        "refs": []
      }
    },
    {
      "section": "Fixed",
      "text": "**Long pages no longer grow and shrink when a block enters or leaves edit mode** (GH #390). Pane-relative end-of-page breathing room is now derived from whether the page content naturally overflows, rather than from the transient presence of a textarea, so its scroll geometry stays stable.",
      "userVisible": true,
      "regressions": [
        "UI-LONG-PAGE-EDIT-HEIGHT-STABILITY-390"
      ],
      "guide": {
        "status": "not-applicable",
        "reason": "This fix restores the already intended behavior and adds no user workflow or control.",
        "refs": []
      },
      "docs": {
        "status": "not-applicable",
        "reason": "The changelog and regression evidence fully describe this patch behavior; no separate contract update is needed.",
        "refs": []
      },
      "website": {
        "status": "not-applicable",
        "reason": "This patch item does not require a separate public marketing-site change.",
        "refs": []
      },
      "blog": {
        "status": "not-applicable",
        "reason": "Patch release; the changelog carries the relevant release detail.",
        "refs": []
      }
    },
    {
      "section": "Fixed",
      "text": "**A held mouse click now shows the block caret on mouse-down, matching Logseq** (GH #368). Exact rendered-text caret placement still applies, and a drag can still select text in the editor or escalate across blocks.",
      "userVisible": true,
      "regressions": [
        "UI-BLOCK-MOUSEDOWN-EDIT-368"
      ],
      "guide": {
        "status": "not-applicable",
        "reason": "This fix restores the already intended behavior and adds no user workflow or control.",
        "refs": []
      },
      "docs": {
        "status": "not-applicable",